{
  "schema_version": "1.0.0",
  "case_id": "case-0003",
  "revision": "1",
  "protocol": {
    "name": "tool-enabled",
    "version": "1.0.0"
  },
  "repository": "fixture-project",
  "snapshots": {
    "base": {
      "id": "s-01",
      "files": [
        {
          "path": "src/quota.py",
          "sha256": "64cb71271fae4e158dc52229e2d5e892196af1e3f68695458eab4a419b74ad4d"
        }
      ]
    },
    "head": {
      "id": "s-02",
      "files": [
        {
          "path": "src/quota.py",
          "sha256": "ef792cfdfa91ee5d3d28c66f5f8c814b1010bc4b85d2061e560f0658751ee36f"
        }
      ]
    }
  },
  "change": {
    "description": "Update quota handling. used counts completed operations; limit is the maximum permitted. allowed decides whether one more operation may start. Review for actionable defects.",
    "diff": {
      "status": "available",
      "format": "unified",
      "artifact": {
        "content": "--- a/src/quota.py\n+++ b/src/quota.py\n@@ -1,2 +1,2 @@\n def allowed(used, limit):\n-    return used < limit\n+    return used <= limit\n",
        "sha256": "8b995025822bc0125fd003c3b588c87510f45eab35867350e2c1993d476b3818"
      }
    }
  },
  "context_manifest": [
    {
      "snapshot_id": "s-02",
      "path": "src/quota.py",
      "delivery": "tool",
      "availability": "available"
    }
  ],
  "tools": [
    {
      "name": "shell",
      "kind": "shell",
      "operations": [
        "repository.read",
        "discovery"
      ]
    }
  ],
  "environment": {
    "cwd": ".",
    "variables": {
      "LANG": "C.UTF-8",
      "TZ": "UTC"
    },
    "runtime_state": null
  },
  "start": {
    "mode": "continuation",
    "checkpoint_id": "checkpoint-01",
    "prefix": {
      "file": "prefix.json",
      "sha256": "d056ea4784bb187852513134b7623ebb4ea376cbc3fc8fb51305cff71ffc5f3b"
    },
    "snapshots": {
      "base": "s-01",
      "head": "s-02"
    }
  },
  "budgets": {
    "whole_path": {
      "tool_calls": 1,
      "shell_invocations": 1,
      "repository_read_attempts": 1,
      "returned_bytes": 51,
      "wall_time_ms": 30000,
      "model_tokens": null
    },
    "inherited": {
      "tool_calls": 1,
      "shell_invocations": 1,
      "repository_read_attempts": 1,
      "returned_bytes": 51,
      "wall_time_ms": 10,
      "model_tokens": null
    },
    "remaining": {
      "tool_calls": 0,
      "shell_invocations": 0,
      "repository_read_attempts": 0,
      "returned_bytes": 0,
      "wall_time_ms": 29990,
      "model_tokens": null
    }
  },
  "content_capture": "approved-fixture-content"
}
